{"llm_run_request_id":"llm-request-demo-0001","schema_version":"1.0.0","tenant_id":"tenant-demo","project_id":"project-demo","run_id":"run-demo-step0","step_id":"0","target_revision":1,"correlation_id":"correlation-demo","idempotency_key":"idempotency-demo","run_mode":"initial_step","logical_session_id":"logical-session-demo-0001","logical_session_revision":1,"context_package_id":"context-demo-step0","context_package_sha256":"aaaaaaaaaaaaaaaaaaaaaaaaaaaaaaaaaaaaaaaaaaaaaaaaaaaaaaaaaaaaaaaa","worker_profile_id":"worker-profile-demo","worker_profile_version":"1.0.0","worker_profile_sha256":"bbbbbbbbbbbbbbbbbbbbbbbbbbbbbbbbbbbbbbbbbbbbbbbbbbbbbbbbbbbbbbbb","provider_id":"provider-demo","model_id":"model-demo","tool_policy_id":"tool-policy-demo","tool_policy_version":"1.0.0","tool_policy_sha256":"cccccccccccccccccccccccccccccccccccccccccccccccccccccccccccccccc","input_sha256":"aaaaaaaaaaaaaaaaaaaaaaaaaaaaaaaaaaaaaaaaaaaaaaaaaaaaaaaaaaaaaaaa","output_contracts":[{"contract_id":"https://heartweb.example/schema/manifest.schema.json","contract_version":"1.0.0","contract_path":"standards/manifest.schema.json","contract_sha256":"dddddddddddddddddddddddddddddddddddddddddddddddddddddddddddddddd"}],"dispatch_policy":{"execution":"fresh","technical_session_reuse":"forbidden"},"requested_at":"2026-08-20T00:00:00Z"}
